{"action":"accept","decision_ids":["dm:review-decision:v1:Kniv6eMsmD-O2oAcEkfea7NsqfJPN6t52H_Z0ND4Nyg"],"executed_at_ms":1800000000002,"memory_event_id":"33000000-0000-4000-8000-000000000003","receipt_id":"dm:review-receipt:v1:r1y1y_m6CxmZ9D7vjFCGsOUEaejTJMvuRh9Ukd5K-Ns","request_event_id":"33000000-0000-4000-8000-000000000002","result":"applied","review_request_id":"dm:review-request:v1:be1j1nbUm1-oJZz9yDyBE61JfLTapCkXHpe2tjLn98s","schema":"dm.review.execution-receipt/v1","successor_request_id":null}
